{
  "specVersion": "0.1",
  "kind": "sitectx.evidence",
  "site": {
    "name": "Example Site",
    "url": "https://example.com/"
  },
  "generatedAt": "2026-05-31T18:30:00Z",
  "evidence": [
    {
      "id": "evidence:pricing:2026-05-31T18-25-00Z",
      "url": "https://example.com/sitectx/evidence/pricing-2026-05-31T18-25-00Z.json",
      "sourceUrl": "https://example.com/pricing",
      "observedAt": "2026-05-31T18:25:00Z",
      "summary": "Public evidence record for the observed pricing page."
    }
  ]
}
